{
  "$schema": "https://json-schema.org/draft/2020-12/schema",
  "$id": "https://grandleon.dev/schemas/source/v1/project.schema.json",
  "type": "object",
  "properties": {
    "schemaVersion": { "const": "1.0.0" },
    "packageId": { "$ref": "common.schema.json#/$defs/packageId" },
    "gameId": { "$ref": "common.schema.json#/$defs/stableId" },
    "title": { "$ref": "common.schema.json#/$defs/displayName" },
    "contentRevision": {
      "type": "string",
      "pattern": "^[0-9]+\\.[0-9]+\\.[0-9]+(?:-[0-9A-Za-z.-]+)?$"
    },
    "themeId": {
      "type": "string",
      "enum": ["temperate", "autumn", "winter", "ashland"],
      "description": "The season the ground of every map in this game is drawn in, on every board and in every ROM. Omit it and the game is drawn in the temperate theme, which is what it looked like before themes existed."
    },
    "characterStyleId": {
      "type": "string",
      "enum": ["medieval", "scifi", "mythical", "nature", "sengoku", "undead", "pirates"],
      "description": "The style this game's characters are drawn in wherever a character names none of its own, on every board and in every ROM. It is a default and a theme, never a gate: a unit type may name any style on this menu, so a medieval game may field an undead enemy or a pirate captain drawn as such. A style supplies one drawing per archetype and nothing else: it never changes which archetype a class draws as, which colour a faction is drawn in, or any rule. Omit it and the characters that name no style of their own are drawn in the medieval style, which is what they looked like before styles existed."
    },
    "characterFigureId": {
      "type": "string",
      "enum": ["first", "second"],
      "description": "The body this game's characters are drawn with wherever a character names none of its own. 'first' is drawn male and 'second' female; the stored values are positions in a menu every client indexes by, and the words a person reads for them are the art library's. A figure is the body a role is drawn at, not the role: every figure draws all eight archetypes, in every style and every faction colour, and choosing one changes no stat, no reach and no rule. It is a default and never a gate, exactly as characterStyleId is. Omit it and the characters that name no figure of their own are drawn with the first, which is what they looked like before figures existed."
    },
    "defaultTurnOrder": {
      "type": "string",
      "enum": ["alternating", "sideBlocks", "initiative"],
      "description": "Who acts next in every battle in this game that does not say otherwise. 'alternating' lets each side pick any unit in turn. 'sideBlocks' runs one whole side then the other and lets whoever holds a block act with any of its characters in any order. 'initiative' interleaves every unit by speed. A battle that states its own turn order overrides this and is never rewritten by changing it. Omit it and battles that state nothing are alternating, which is what they were before this setting existed."
    },
    "characterLoss": {
      "type": "string",
      "enum": ["permanent", "recoverable"],
      "description": "What becomes of a character in this game who falls in battle. 'permanent' is a death: the company never fields that character again, and their kit is what is left of them. 'recoverable' is a wound: they are carried off the field and rejoin the company once the battle is over, still holding whatever they were carrying when they went down. Under either, a character reduced to no health leaves the battlefield the moment they reach it, so this decides only what the campaign records after the battle and never what the battle itself does. Omit it and a character who falls is gone for good, which is what a fall meant before this setting existed."
    },
    "invulnerableForTesting": {
      "type": "boolean",
      "description": "Whether the members of the player's own company cannot be reduced below one health, so that a blow that would defeat one leaves them standing at one instead. This is a testing aid and not a way to play: it is here so that somebody walking their own campaign through can read the writing and follow the flow without having to deal with dying on the way. It is deliberately not a third value of characterLoss, because it is not an answer to the question that setting asks. It is compiled into the package like every other rule, and it changes what the battles do: the same project with it on and the same project with it off play differently, and two people holding the same package always get the same battles out of it. Omit it and nobody is protected from anything, which is what every character faced before this setting existed."
    },
    "classes": {
      "type": "array",
      "items": { "$ref": "class.schema.json" },
      "maxItems": 100000
    },
    "weaponTypes": {
      "type": "array",
      "items": { "$ref": "weapon-type.schema.json" },
      "maxItems": 100000
    },
    "itemTypes": {
      "type": "array",
      "items": { "$ref": "item-type.schema.json" },
      "maxItems": 100000
    },
    "unitTypes": {
      "type": "array",
      "items": { "$ref": "unit-type.schema.json" },
      "maxItems": 100000
    },
    "weapons": {
      "type": "array",
      "items": { "$ref": "weapon.schema.json" },
      "maxItems": 100000
    },
    "items": {
      "type": "array",
      "items": { "$ref": "item.schema.json" },
      "maxItems": 100000
    },
    "maps": {
      "type": "array",
      "items": { "$ref": "map.schema.json" },
      "maxItems": 10000
    },
    "factions": {
      "type": "array",
      "items": { "$ref": "faction.schema.json" },
      "maxItems": 100000
    },
    "abilities": {
      "type": "array",
      "items": { "$ref": "ability.schema.json" },
      "maxItems": 100000
    },
    "objectives": {
      "type": "array",
      "items": { "$ref": "objective.schema.json" },
      "maxItems": 100000
    },
    "campaigns": {
      "type": "array",
      "items": { "$ref": "campaign.schema.json" },
      "maxItems": 10000
    },
    "dialogues": {
      "type": "array",
      "items": { "$ref": "dialogue.schema.json" },
      "maxItems": 100000
    },
    "notes": { "$ref": "common.schema.json#/$defs/notes" },
    "extensions": { "$ref": "common.schema.json#/$defs/extensions" }
  },
  "required": [
    "schemaVersion",
    "packageId",
    "gameId",
    "title",
    "contentRevision",
    "classes",
    "unitTypes",
    "weapons",
    "items",
    "maps"
  ],
  "additionalProperties": false
}
