{
  "schemaVersion": "1.0.0",
  "packageId": "6c2a48f1-9d73-4b50-8e19-27ac53d0be6f",
  "gameId": "testing.invulnerability",
  "title": "Testing Invulnerability",
  "contentRevision": "1.0.0",
  "characterLoss": "permanent",
  "invulnerableForTesting": true,
  "classes": [
    {
      "id": "fighter",
      "name": "Fighter",
      "baseStats": { "health": 10, "movement": 3, "strength": 2, "defense": 1 }
    }
  ],
  "unitTypes": [
    { "id": "guardian", "name": "Guardian", "classId": "fighter" }
  ],
  "weapons": [],
  "items": [],
  "maps": [
    {
      "id": "field",
      "name": "Field",
      "width": 2,
      "height": 2,
      "terrain": ["plain", "plain", "plain", "plain"]
    }
  ],
  "campaigns": [
    {
      "id": "main",
      "name": "Main",
      "roster": [
        { "id": "hero", "name": "Hero of the Field", "unitTypeId": "guardian" }
      ],
      "flow": {
        "contractVersion": "1.0.0",
        "entryNodeId": "opening",
        "nodes": [
          {
            "id": "opening",
            "name": "Opening",
            "kind": "encounter",
            "mapId": "field",
            "placements": [
              {
                "id": "hero",
                "memberId": "hero",
                "unitTypeId": "guardian",
                "side": "first",
                "x": 0,
                "y": 0
              },
              { "id": "rival", "unitTypeId": "guardian", "side": "second", "x": 1, "y": 1 }
            ],
            "transitions": [
              { "id": "onward", "targetNodeId": "end", "priority": 0 }
            ]
          },
          {
            "id": "end",
            "name": "End",
            "kind": "terminal",
            "transitions": []
          }
        ]
      }
    }
  ]
}
